{
  "schema_version": "0.1",
  "source": {
    "alignments_path": "reports\\acceptance\\2026-09-11-abc\\run\\m05\\alignments.json",
    "alignments_sha256": "d41459777f500843afeae6e509c3b7fcdc3666b5332f2b824d2046e5d8a587de",
    "stream_id": "payload-download-01-d8f9c37a5714-tcp-stream-0-node1_to_node0-0000-215ff970eee6",
    "message_count": 1,
    "aligned_message_count": 0
  },
  "status": "empty",
  "parameters": {
    "method": "aligned_column_statistics",
    "min_cluster_samples": 2,
    "min_presence_ratio": 0.5,
    "length_widths": [
      1,
      2,
      4
    ],
    "min_relation_samples": 3,
    "max_length_overhead": 64
  },
  "cluster_formats": [],
  "unaligned_messages": [
    {
      "message_id": "payload-download-01-d8f9c37a5714-tcp-stream-0-node1_to_node0-0000-215ff970eee6-message-000000",
      "reason": "m04_noise"
    }
  ],
  "metrics": {
    "analyzed_cluster_count": 0,
    "analyzed_message_count": 0,
    "field_candidate_count": 0,
    "boundary_candidate_count": 0,
    "length_hypothesis_count": 0
  },
  "warnings": [
    "Field candidates are statistical runs, not confirmed protocol semantics.",
    "Length hypotheses require exact relations in the observed sample but may still be coincidental.",
    "Small clusters, low-quality M05 alignments, compression, or encryption can make boundaries unreliable."
  ]
}
